<?xml version="1.0" encoding="UTF-8"?>
<!DOCTYPE BWB SYSTEM "BWB_17-11-16.dtd" >
<BWB>

<!--ein VERB !!!-->


<artikel id="tändeln">
<lemma-position>
<lemma>tändeln</lemma>
<!--In lemma-variante stets die Langform angeben, die in Suchindex soll.-->
<lemma-variante kurzform="-a-">tandeln</lemma-variante>
<grammatik wortart="Vb"/></lemma-position>

<bedeutung-position nr="1">
<bedeutung>(mit Tauschwaren od. Trödel) Handel treiben</bedeutung>
<verbreitung-position><verbreitung-angabe bezirk="OB" häufigkeit="vielf."/>
<verbreitung-angabe bezirk="NB" häufigkeit="mehrf."/>
<verbreitung-angabe bezirk="OP" häufigkeit="vereinz."/>
<verbreitung-angabe bezirk="MF" häufigkeit="vereinz."/></verbreitung-position>


<beleg-position>
<beleg-angabe belegt="nach1958"><beleg-text>dea’ma Buiddl danddln?</beleg-text>
<beleg-quelle><beleg-region><ort>Dachau</ort><landkreis>DAH</landkreis></beleg-region></beleg-quelle></beleg-angabe>

<beleg-angabe><beleg-text><kontext anfuehrung="ja">Trödelwaare verkaufen … <beleg>dándln</beleg></kontext></beleg-text><beleg-quelle></beleg-quelle></beleg-angabe>
<beleg-angabe><beleg-text>dạndln </beleg-text><beleg-quelle><beleg-region><ort>Baar </ort><landkreis>ND</landkreis></beleg-region><literatur-quelle>SBS X,8</literatur-quelle><beleg-zeit></beleg-zeit></beleg-quelle></beleg-angabe>
<beleg-angabe><beleg-text>min Läid <kontext>(Feuer)</kontext> dandln <kontext anfuehrung="ja">zündeln</kontext></beleg-text><beleg-quelle></beleg-quelle></beleg-angabe>


</beleg-position>
</bedeutung-position>
<bedeutung-position nr="2">
<bedeutung>spielen</bedeutung>
<bedeutung-variante nr="2a" id="tändeln-2a">
<bedeutung>mit Spielsachen spielen</bedeutung></bedeutung-variante></bedeutung-position>
</artikel>




























<!--nun ein neuerer Artikel-->
<artikel id="Darm" sort="Därm">
<lemma-position>
<lemma>Darm</lemma>
<lemma-verweise>
<lemma-variante>Gedärm</lemma-variante><!--Generieren von Verweisartikeln-->
<lemma-variante>Daram</lemma-variante></lemma-verweise>
<grammatik wortart="N" genus="M"/>
</lemma-position>
<bedeutung-position id="Darm-00"><bedeutung belegt="ausgestorben">nnnhh</bedeutung>
<beleg-position><beleg-angabe><beleg-text></beleg-text><beleg-quelle></beleg-quelle></beleg-angabe></beleg-position>
</bedeutung-position>
<bedeutung-position nr="1" id="Darm-1"><!--Sprungziel für Verweise-->
<bedeutung>Darm, Gedärm</bedeutung>
<verbreitung-position>
<verbreitung-angabe bezirk="Gesamtgebiet" häufigkeit="vielf."/>
<verbreitung-angabe häufigkeit="vielf." bezirk="OB"/> 
</verbreitung-position>


<beleg-position><beleg-angabe><beleg-text>er hats im Darm </beleg-text>
<beleg-quelle><beleg-region ort-landkreis="Wasserburg-WAS"></beleg-region><beleg-zeit>9.Jh</beleg-zeit><literatur-quelle></literatur-quelle></beleg-quelle></beleg-angabe> 
<beleg-angabe><beleg-text><kontext anfuehrung="ja">für Leberwürste die <beleg>Darm</beleg> des Schweins</kontext></beleg-text>
<beleg-quelle><beleg-region ort-landkreis="Prackenbach-VIT"></beleg-region><literatur-quelle></literatur-quelle><beleg-region></beleg-region></beleg-quelle></beleg-angabe>

<beleg-angabe><beleg-text>Därmer hobn si vaschlinglt</beleg-text>
<beleg-quelle><beleg-region ort-landkreis="Rothenstadt-NEW"></beleg-region></beleg-quelle></beleg-angabe>

<beleg-angabe><beleg-text>vom Wasser kröigt ma’ bloue Daarma</beleg-text>
<beleg-quelle><literatur-quelle>Oberpfalz 80 (1992) 145</literatur-quelle></beleg-quelle></beleg-angabe>

<beleg-angabe><beleg-text>intestinis … indarmum</beleg-text>
<beleg-quelle><beleg-zeit>8./9.Jh.</beleg-zeit><literatur-quelle>StSG. I,154,32</literatur-quelle></beleg-quelle></beleg-angabe>

<beleg-angabe><beleg-text>chrebs dærmlein streket sich … vntz <kontext>[bis]</kontext> an daz end seins swantzes</beleg-text>
<beleg-quelle><literatur-quelle>KONRADvM BdN 276,1f.</literatur-quelle></beleg-quelle></beleg-angabe>


<beleg-angabe><beleg-text>in stechen, daß im die därm heraus sollen geen </beleg-text>
<beleg-quelle><beleg-region ort-landkreis="Hankfn-SR"></beleg-region><beleg-zeit>1550</beleg-zeit><literatur-quelle>HELM Obrigkeit 171</literatur-quelle></beleg-quelle></beleg-angabe>


<phraseologie>
<phrase><beleg-angabe><beleg-text>dö dickn Da(r)m <kontext>Dickdärme</kontext></beleg-text>
<beleg-quelle><beleg-region ort-landkreis="Mengkfn-DGF"></beleg-region></beleg-quelle></beleg-angabe></phrase>



<phrase><beleg-typ>Dünner <lemma-referenz abk="D." vollform="Darm">D.</lemma-referenz> </beleg-typ>
 
<bedeutung>Dünndarm</bedeutung>
<verbreitung-angabe bezirk="NB" häufigkeit="vereinz."/><!--Doppelpunkt-->
<beleg-angabe><beleg-text>dö dina Da(r)m</beleg-text>
<beleg-quelle><beleg-region ort-landkreis="Mittich-GRI"></beleg-region></beleg-quelle></beleg-angabe>
</phrase>
<phrase><beleg-angabe belegt="nach1958"><beleg-text>toter Darm</beleg-text>
<beleg-quelle><beleg-region ort-landkreis="Söldenau-VOF"></beleg-region></beleg-quelle></beleg-angabe></phrase>
<phrase><beleg-angabe belegt="nach1958"><beleg-text>Wöi a Doam <kontext anfuehrung="ja">lang und dünn</kontext></beleg-text>
<beleg-quelle><beleg-region ort-landkreis="Brennbg-R"></beleg-region></beleg-quelle></beleg-angabe></phrase>


<phrase><beleg-angabe><beleg-text>dẹị siaht wẹị a asgschdrafda Doarm <kontext anfuehrung="ja">sie ist sehr mager</kontext></beleg-text>
<beleg-quelle><literatur-quelle>KONRAD nördl.Opf. 63</literatur-quelle>
<literatur-quelle quelle-art="ähnlich">KAPS Welt d.Bauern 61</literatur-quelle></beleg-quelle></beleg-angabe>
<beleg-angabe><beleg-text>dea schat hea wia wen a grad an Doam het dua und dua <kontext anfuehrung="ja">ist bleich und mager</kontext></beleg-text>
<beleg-quelle><beleg-region ort-landkreis="Iggensbach-DEG"></beleg-region>
<!--Hier nur Landkreis, daher als "Bezirk" angelegt ...-->
<beleg-region quelle-art="ähnlich" bezirk="SR"></beleg-region></beleg-quelle></beleg-angabe>
</phrase>
</phraseologie>
</beleg-position>
</bedeutung-position>
<!--zweite Bedeutung-->
<bedeutung-position nr="2" id="Darm-2">
<bedeutung>aus Tierdarm Bestehendes</bedeutung>

<bedeutung-position nr="2a" id="Darm-2a">
<bedeutung>Wursthaut</bedeutung>

<verbreitung-position>
<verbreitung-angabe bezirk="MF" häufigkeit="vielf."/>
<verbreitung-angabe bezirk="NB" häufigkeit="mehrf." belegt="nach1958"/>
<verbreitung-angabe bezirk="OP" häufigkeit="mehrf."/>
<verbreitung-angabe bezirk="Restgebiet" häufigkeit="vereinz."/></verbreitung-position>

<beleg-position>
<beleg-angabe><beleg-text>Darm, Saitling</beleg-text>
<beleg-quelle><beleg-region ort-landkreis="Oalting-STA"></beleg-region></beleg-quelle></beleg-angabe>
<beleg-angabe belegt="nach1958"><beleg-text>i hed no an Badzn Gwuaschdad <kontext>(Wurstteig)</kontext> då, bringsdas no ei öd Darm?</beleg-text>
<beleg-quelle><beleg-region ort-landkreis="Grafenau-GRA"></beleg-region></beleg-quelle></beleg-angabe></beleg-position>
</bedeutung-position>
<bedeutung-position nr="2b" id="Darm-2b"><bedeutung>Darmsaite</bedeutung>
<verbreitung-position><verbreitung-angabe bezirk="NB" häufigkeit="vereinz."/></verbreitung-position><!--: ????--><beleg-position><beleg-angabe><beleg-text>Soatn, Darm <kontext>auf Streichinstrumenten</kontext></beleg-text>
<beleg-quelle><beleg-region ort-landkreis="Rgbg-R"></beleg-region></beleg-quelle></beleg-angabe></beleg-position></bedeutung-position>
</bedeutung-position>
<bedeutung-position nr="3" id="Darm-3"><bedeutung>lange schmale Fläche, schmaler Raum</bedeutung>
<verbreitung-position><verbreitung-angabe bezirk="OB" häufigkeit="vielf."/>
<verbreitung-angabe bezirk="Restgebiet" häufigkeit="mehrf."/></verbreitung-position>
<beleg-position><beleg-angabe><beleg-text>grod a so a schmoicha Darm <kontext>sehr schmales Feld</kontext></beleg-text>
<beleg-quelle><beleg-region><ort>Frasdf</ort><landkreis>RO</landkreis></beleg-region></beleg-quelle></beleg-angabe></beleg-position></bedeutung-position>


<etymologie-position>
 Ahd. <lemma-form typ="ahd.">darm</lemma-form>, mhd. 
<lemma-form typ="mhd.">darm</lemma-form> <abk langform="stark männlich ">stm.</abk>, germ. Wort <abk langform="indogermanisch">idg.</abk> Herkunft; <beleg-quelle><literatur-quelle>KLUGE-SEEBOLD 181</literatur-quelle></beleg-quelle></etymologie-position>


<lautung-position typ="ltg">